{
  "app_id": "cy_knit_lx",
  "generated_at": "2026-08-07T06:35:31Z",
  "inputs_hash": "51756e83aa46529367ae5ee52ebf3b8de02f944117f51ac3d11aaa200d925d80",
  "sources": [
    {
      "source_id": "src_3590e80a90d569e0",
      "scope": "input",
      "path": "inputs/.DS_Store",
      "name": ".DS_Store",
      "kind": "other",
      "hash": "440cd6285410123319e2e68b44fa7e7603102daf809f73c788bdb54d399e525a",
      "size": 6148,
      "parse_status": "ignored",
      "ignored": true,
      "ignored_reason": "system_or_temporary_file"
    },
    {
      "source_id": "src_79482a57f92a93f4",
      "scope": "input",
      "path": "inputs/GEO信息收集表(2).xlsx",
      "name": "GEO信息收集表(2).xlsx",
      "kind": "info_form",
      "hash": "3a3394a0981d2da6a1a46efef9759d5d9141cbcd6dddc671f53a189e3d0622a0",
      "size": 16394,
      "parse_status": "extractable",
      "ignored": false,
      "ignored_reason": null
    },
    {
      "source_id": "src_7e3a541239b6c3ad",
      "scope": "input",
      "path": "inputs/关键词问题库.xlsx",
      "name": "关键词问题库.xlsx",
      "kind": "keywords",
      "hash": "642597762ed908fb4f396839c31cac25c93a9c8126a3f125cfacba0ca1dd9488",
      "size": 20890,
      "parse_status": "indexed_only",
      "ignored": false,
      "ignored_reason": null
    },
    {
      "source_id": "src_00e5ea00ba9c245e",
      "scope": "input",
      "path": "inputs/晨源客服质检分析报告.pdf",
      "name": "晨源客服质检分析报告.pdf",
      "kind": "chat_logs",
      "hash": "aad92832c14b335871580fb2db79df02e32a6d1d5f1eb3d6023626c18de0e1df",
      "size": 1356718,
      "parse_status": "extractable",
      "ignored": false,
      "ignored_reason": null
    },
    {
      "source_id": "src_00f582365f79e94c",
      "scope": "input",
      "path": "inputs/晨源针织知识库.docx",
      "name": "晨源针织知识库.docx",
      "kind": "knowledge_docx",
      "hash": "9641b5c59e1fe310bc92d356cd381096dc101fa8a7efde6e23ab6f1b05237a3e",
      "size": 16987,
      "parse_status": "extractable",
      "ignored": false,
      "ignored_reason": null
    },
    {
      "source_id": "src_15363e0b55cff315",
      "scope": "input",
      "path": "inputs/晨源针织询盘报告.xlsx",
      "name": "晨源针织询盘报告.xlsx",
      "kind": "chat_logs",
      "hash": "fc7de570b51293af7db6cfe32fc6283377d7321867f0c95616cc7137f97cd074",
      "size": 125315,
      "parse_status": "extractable",
      "ignored": false,
      "ignored_reason": null
    },
    {
      "source_id": "src_3a589d396b106c71",
      "scope": "input",
      "path": "inputs/身份证信息及产品图片/.DS_Store",
      "name": ".DS_Store",
      "kind": "other",
      "hash": "f48e9df32478f5d490685823e7361a6af1eb3ffe796bf1519f5c398523c36aa9",
      "size": 6148,
      "parse_status": "ignored",
      "ignored": true,
      "ignored_reason": "system_or_temporary_file"
    },
    {
      "source_id": "src_0097adcecb6a8110",
      "scope": "input",
      "path": "inputs/身份证信息及产品图片/599559e0eb36207062d7cac9a2cc8a6c.jpg",
      "name": "599559e0eb36207062d7cac9a2cc8a6c.jpg",
      "kind": "legal_id",
      "hash": "549cff533e31dbc6b04a0f3b6b098658812329637d11055509b626647bcf933b",
      "size": 281916,
      "parse_status": "ignored",
      "ignored": true,
      "ignored_reason": "legal_id_skip"
    },
    {
      "source_id": "src_96ef8d20c51ee59d",
      "scope": "input",
      "path": "inputs/身份证信息及产品图片/b2a8d2c23ab3fa8781eb44e3f2ce7d86.jpg",
      "name": "b2a8d2c23ab3fa8781eb44e3f2ce7d86.jpg",
      "kind": "legal_id",
      "hash": "9f01b2f8655c4537c721950f875b6e32de97e6c09b66f29fd1bd0bd81ed3bad8",
      "size": 286198,
      "parse_status": "ignored",
      "ignored": true,
      "ignored_reason": "legal_id_skip"
    },
    {
      "source_id": "src_5f2ebdb5a11cdde1",
      "scope": "input",
      "path": "inputs/身份证信息及产品图片/bacca2fe28e7052a3a170d6d21b58e97.jpg",
      "name": "bacca2fe28e7052a3a170d6d21b58e97.jpg",
      "kind": "legal_id",
      "hash": "f746df9fd6e8deca39bda0dc1847446b1b9660b0071ebe41972642112e9d4797",
      "size": 393816,
      "parse_status": "ignored",
      "ignored": true,
      "ignored_reason": "legal_id_skip"
    },
    {
      "source_id": "src_cad101380db7d924",
      "scope": "input",
      "path": "inputs/身份证信息及产品图片/校服罗文袖口/O1CN01vrJwzK1EGR8S5mVsK_!!2215349380324-0-cib.jpg",
      "name": "O1CN01vrJwzK1EGR8S5mVsK_!!2215349380324-0-cib.jpg",
      "kind": "product_image",
      "hash": "426defb5a0a2ecd9f5a4a381c74663a11577f887c3a19f7fe8af772dde638e54",
      "size": 174564,
      "parse_status": "indexed_only",
      "ignored": false,
      "ignored_reason": null
    },
    {
      "source_id": "src_82ab54ee1385c8c3",
      "scope": "input",
      "path": "inputs/身份证信息及产品图片/罗纹袖口/O1CN010MXOtl1EGR8a8hK82_!!2215349380324-0-cib.jpg",
      "name": "O1CN010MXOtl1EGR8a8hK82_!!2215349380324-0-cib.jpg",
      "kind": "product_image",
      "hash": "09524358e0fa3e06ad5886f87fc45e7d8fe086f0a7434288caf781b0515b6af1",
      "size": 230065,
      "parse_status": "indexed_only",
      "ignored": false,
      "ignored_reason": null
    },
    {
      "source_id": "src_5d18e58180fe6016",
      "scope": "input",
      "path": "inputs/身份证信息及产品图片/罗纹袖口/O1CN01C2hLUz1EGR8a2pyub_!!2215349380324-0-cib.jpg",
      "name": "O1CN01C2hLUz1EGR8a2pyub_!!2215349380324-0-cib.jpg",
      "kind": "product_image",
      "hash": "dbb3818bbbe7555e34bfa8bd967c338740b5657e7d996bdcae36598bad9af7f1",
      "size": 303447,
      "parse_status": "indexed_only",
      "ignored": false,
      "ignored_reason": null
    },
    {
      "source_id": "src_55fe874953142ba7",
      "scope": "input",
      "path": "inputs/身份证信息及产品图片/罗纹袖口/O1CN01DNY1px1EGR8azZpdC_!!2215349380324-0-cib.jpg",
      "name": "O1CN01DNY1px1EGR8azZpdC_!!2215349380324-0-cib.jpg",
      "kind": "product_image",
      "hash": "ae7cb1ae1c35b53fb4238ad12cb1b85f808eca9e88979d88a7903d0eeb12e12c",
      "size": 257824,
      "parse_status": "indexed_only",
      "ignored": false,
      "ignored_reason": null
    },
    {
      "source_id": "src_0c560cf7d541f457",
      "scope": "input",
      "path": "inputs/身份证信息及产品图片/罗纹袖口/O1CN01DPetW71EGRSMojTpe_!!2215349380324-0-cib.jpg",
      "name": "O1CN01DPetW71EGRSMojTpe_!!2215349380324-0-cib.jpg",
      "kind": "product_image",
      "hash": "ec5febe5709d3d05662de57293960a83ec11327f43d8e3ba66da2e2fdd605476",
      "size": 136901,
      "parse_status": "indexed_only",
      "ignored": false,
      "ignored_reason": null
    },
    {
      "source_id": "src_226e0036fcda1287",
      "scope": "input",
      "path": "inputs/身份证信息及产品图片/罗纹袖口/O1CN01N2T7tf1EGRTbibHHo_!!2215349380324-0-cib.jpg",
      "name": "O1CN01N2T7tf1EGRTbibHHo_!!2215349380324-0-cib.jpg",
      "kind": "product_image",
      "hash": "419ab3cef8f897fc7ea542fbaade4d2c65b250572018d05e2d2335035eb2e75d",
      "size": 262505,
      "parse_status": "indexed_only",
      "ignored": false,
      "ignored_reason": null
    },
    {
      "source_id": "src_47872b7410eb6583",
      "scope": "input",
      "path": "inputs/身份证信息及产品图片/罗纹袖口/O1CN01T91nCq1EGRMp24Wbh_!!2215349380324-0-cib.jpg",
      "name": "O1CN01T91nCq1EGRMp24Wbh_!!2215349380324-0-cib.jpg",
      "kind": "product_image",
      "hash": "29d3956803e3f744238e2c73b6ef8fd5c5a0f913ca4c4ce624ab7275b1a541dd",
      "size": 380512,
      "parse_status": "indexed_only",
      "ignored": false,
      "ignored_reason": null
    },
    {
      "source_id": "src_0c4eeced96005307",
      "scope": "input",
      "path": "inputs/身份证信息及产品图片/罗纹袖口/O1CN01UyLr1T1EGR8S85RM0_!!2215349380324-0-cib.jpg",
      "name": "O1CN01UyLr1T1EGR8S85RM0_!!2215349380324-0-cib.jpg",
      "kind": "product_image",
      "hash": "ba690fc210bb8a73a4d95f750e3fc198f2f29e4d8f09d138b8cd3eec3a2be2c4",
      "size": 176891,
      "parse_status": "indexed_only",
      "ignored": false,
      "ignored_reason": null
    },
    {
      "source_id": "src_426ed50db3e31387",
      "scope": "input",
      "path": "inputs/身份证信息及产品图片/罗纹袖口/O1CN01VurmU61EGRSHyqo92_!!2215349380324-0-cib.jpg",
      "name": "O1CN01VurmU61EGRSHyqo92_!!2215349380324-0-cib.jpg",
      "kind": "product_image",
      "hash": "6237e6462ef022fd1b228d5bd6ce640ee8f1b1262b4a95d9b7023de594d911a2",
      "size": 312977,
      "parse_status": "indexed_only",
      "ignored": false,
      "ignored_reason": null
    },
    {
      "source_id": "src_c8d684932eec76d2",
      "scope": "input",
      "path": "inputs/身份证信息及产品图片/罗纹袖口/O1CN01vwueio1EGRSN1iveE_!!2215349380324-0-cib.jpg",
      "name": "O1CN01vwueio1EGRSN1iveE_!!2215349380324-0-cib.jpg",
      "kind": "product_image",
      "hash": "e29529e8868dac97bad4572ee0d3f020e64bffa10ec16bc126ab54e3415e71bf",
      "size": 338834,
      "parse_status": "indexed_only",
      "ignored": false,
      "ignored_reason": null
    },
    {
      "source_id": "src_48953795c0700b03",
      "scope": "input",
      "path": "inputs/身份证信息及产品图片/罗纹袖口/O1CN01ximHGq1EGR8agoaTb_!!2215349380324-0-cib.jpg",
      "name": "O1CN01ximHGq1EGR8agoaTb_!!2215349380324-0-cib.jpg",
      "kind": "product_image",
      "hash": "4595aa7bcd55ae9b5953fdfb691eba9d6f61c0595a624effbbf0bb29f72d52c4",
      "size": 319197,
      "parse_status": "indexed_only",
      "ignored": false,
      "ignored_reason": null
    },
    {
      "source_id": "src_d431f76cfc9e0c29",
      "scope": "input",
      "path": "inputs/身份证信息及产品图片/罗纹袖口/O1CN01yMyzFo1EGRTbhxJdh_!!2215349380324-0-cib.jpg",
      "name": "O1CN01yMyzFo1EGRTbhxJdh_!!2215349380324-0-cib.jpg",
      "kind": "product_image",
      "hash": "bb33eb1341166899e39e7a69b96c539780cef2232cf97559201b7ada19a6fb04",
      "size": 341358,
      "parse_status": "indexed_only",
      "ignored": false,
      "ignored_reason": null
    },
    {
      "source_id": "src_92deff62f67fadd6",
      "scope": "input",
      "path": "inputs/身份证信息及产品图片/领口/O1CN01ALZ1am1EGRTWBQQds_!!2215349380324-0-cib.jpg",
      "name": "O1CN01ALZ1am1EGRTWBQQds_!!2215349380324-0-cib.jpg",
      "kind": "product_image",
      "hash": "df88818ac0b2903a4ace3e07e6cdce4743871cbae2dcdefe8e044bbcf325e034",
      "size": 107702,